{
  "schema_version": "1.0.0",
  "id": "mmlu-pro",
  "name": "MMLU-Pro",
  "category": "knowledge",
  "subcategory": "multitask",
  "description": "Enhanced MMLU with 12,289 graduate-level questions across 14 subjects with 10 answer choices (vs 4 in original MMLU). Emphasizes reasoning over knowledge recall.",
  "creator": "TIGER AI Lab",
  "year_introduced": 2024,
  "url": "https://huggingface.co/spaces/TIGER-Lab/MMLU-Pro",
  "paper": "https://arxiv.org/abs/2406.01574",
  "github": "https://github.com/TIGER-AI-Lab/MMLU-Pro",
  "dataset": {
    "num_problems": 12289,
    "source": "Graduate-level questions across 14 subjects"
  },
  "metrics": [
    {
      "name": "accuracy",
      "range": "0-100%",
      "primary": true
    }
  ],
  "saturation": "not_saturated",
  "contamination_resistance": "medium",
  "adoption": "universal",
  "tier": 1,
  "reported_by": ["openai", "anthropic", "google", "deepseek", "meta"],
  "notes": "Top: Gemini 3 Pro 90.1%. 16-33% score drop vs original MMLU. Still discriminative with 10-choice format.",
  "meta": {
    "created_at": "2026-02-07T12:00:00Z",
    "updated_at": "2026-02-07T12:00:00Z"
  }
}
