{
  "schema_version": "1.0.0",
  "id": "video-mme",
  "name": "Video-MME",
  "category": "multimodal",
  "subcategory": "video-understanding",
  "description": "Comprehensive video understanding benchmark with 900 videos and 744 subtitles testing video analysis, temporal reasoning, and long-context processing across real-world scenarios.",
  "creator": "CVPR 2025 Team",
  "year_introduced": 2024,
  "url": "https://video-mme.github.io/home_page.html",
  "paper": "https://arxiv.org/abs/2405.21075",
  "github": "https://github.com/MME-Benchmarks/Video-MME",
  "dataset": {
    "num_problems": 900,
    "source": "Real-world video scenarios with temporal challenges"
  },
  "metrics": [
    {
      "name": "accuracy",
      "range": "0-100%",
      "primary": true
    }
  ],
  "saturation": "not_saturated",
  "contamination_resistance": "high",
  "adoption": "high",
  "tier": 2,
  "reported_by": ["openai", "google", "anthropic", "meta"],
  "notes": "Industry standard for video understanding. Gemini 2.5 Pro: 84.8%. CVPR 2025 spotlight paper.",
  "meta": {
    "created_at": "2026-02-07T12:00:00Z",
    "updated_at": "2026-02-07T12:00:00Z"
  }
}
