{
  "schema_version": "1.0.0",
  "id": "longbench-v2",
  "name": "LongBench v2",
  "category": "long_context",
  "subcategory": "context-reasoning",
  "description": "Long-context benchmark with 503 challenging multiple-choice questions across 6 real-world categories with contexts 8K-2M tokens. Tests document QA, multi-doc reasoning, in-context learning, dialogue, code, and structured data.",
  "creator": "Tsinghua University (THUDM)",
  "year_introduced": 2024,
  "url": "https://longbench2.github.io/",
  "paper": "https://arxiv.org/abs/2412.15204",
  "github": "https://github.com/THUDM/LongBench",
  "dataset": {
    "num_problems": 503,
    "source": "Real-world long-context tasks across 6 categories (8K-2M tokens)"
  },
  "metrics": [
    {
      "name": "accuracy",
      "range": "0-100%",
      "primary": true
    }
  ],
  "saturation": "not_saturated",
  "contamination_resistance": "high",
  "adoption": "medium",
  "tier": 2,
  "reported_by": ["google", "anthropic", "openai"],
  "notes": "Top: o1-preview 57.7% vs human baseline 53.7%. ACL 2025. Tests 8K to 2M token contexts.",
  "meta": {
    "created_at": "2026-02-07T12:00:00Z",
    "updated_at": "2026-02-07T12:00:00Z"
  }
}
